shwetank@shwetank-VirtualBox:~/OpenROAD-flow-scripts/flow$ tree logs/sky130hd/VSDBabySoC/
logs/sky130hd/VSDBabySoC/
└── base
    ├── 1_1_yosys_canonicalize.log
    ├── 1_2_yosys.log
    ├── 2_1_floorplan.json
    ├── 2_1_floorplan.log
    ├── 2_2_floorplan_macro.json
    ├── 2_2_floorplan_macro.log
    ├── 2_3_floorplan_tapcell.json
    ├── 2_3_floorplan_tapcell.log
    ├── 2_4_floorplan_pdn.json
    ├── 2_4_floorplan_pdn.log
    ├── 3_1_place_gp_skip_io.json
    ├── 3_1_place_gp_skip_io.log
    ├── 3_2_place_iop.json
    ├── 3_2_place_iop.log
    ├── 3_3_place_gp.json
    ├── 3_3_place_gp.log
    ├── 3_4_place_resized.json
    ├── 3_4_place_resized.log
    ├── 3_5_place_dp.json
    ├── 3_5_place_dp.log
    ├── 4_1_cts.json
    ├── 4_1_cts.log
    ├── 5_1_grt.json
    ├── 5_1_grt.log
    ├── 5_2_route.json
    ├── 5_2_route.log
    ├── 5_3_fillcell.json
    ├── 5_3_fillcell.log
    ├── 6_1_fill.json
    ├── 6_1_fill.log
    ├── 6_1_merge.log
    ├── 6_report.json
    └── 6_report.log

2 directories, 33 files
shwetank@shwetank-VirtualBox:~/OpenROAD-flow-scripts/flow$ tree results/sky130hd/VSDBabySoC/
results/sky130hd/VSDBabySoC/
└── base
    ├── 1_1_yosys_canonicalize.rtlil
    ├── 1_2_yosys.v
    ├── 1_synth.sdc
    ├── 1_synth.v
    ├── 2_1_floorplan.odb
    ├── 2_1_floorplan.sdc
    ├── 2_2_floorplan_macro.odb
    ├── 2_2_floorplan_macro.tcl
    ├── 2_3_floorplan_tapcell.odb
    ├── 2_4_floorplan_pdn.odb
    ├── 2_floorplan.odb
    ├── 2_floorplan.sdc
    ├── 3_1_place_gp_skip_io.odb
    ├── 3_2_place_iop.odb
    ├── 3_2_place_iop.tcl
    ├── 3_3_place_gp.odb
    ├── 3_4_place_resized.odb
    ├── 3_5_place_dp.odb
    ├── 3_place.odb
    ├── 3_place.sdc
    ├── 4_1_cts.odb
    ├── 4_cts.odb
    ├── 4_cts.sdc
    ├── 5_1_grt.odb
    ├── 5_1_grt.sdc
    ├── 5_2_route.odb
    ├── 5_3_fillcell.odb
    ├── 5_route.odb
    ├── 5_route.sdc
    ├── 6_1_fill.odb
    ├── 6_1_fill.sdc
    ├── 6_1_merged.gds
    ├── 6_final.def
    ├── 6_final.gds
    ├── 6_final.odb
    ├── 6_final.sdc
    ├── 6_final.spef
    ├── 6_final.v
    ├── clock_period.txt
    ├── mem.json
    ├── route.guide
    ├── updated_clks.sdc
    └── vsdbabysoc.spef

2 directories, 43 files
shwetank@shwetank-VirtualBox:~/OpenROAD-flow-scripts/flow$ tree reports/sky130hd/VSDBabySoC/
reports/sky130hd/VSDBabySoC/
└── base
    ├── 2_floorplan_final.rpt
    ├── 3_detailed_place.rpt
    ├── 3_global_place.rpt
    ├── 3_resizer.rpt
    ├── 4_cts_final.rpt
    ├── 5_detailed_route.rpt
    ├── 5_global_route.rpt
    ├── 5_route_drc.rpt
    ├── 5_route_drc.rpt-10.rpt
    ├── 5_route_drc.rpt-15.rpt
    ├── 5_route_drc.rpt-20.rpt
    ├── 5_route_drc.rpt-25.rpt
    ├── 5_route_drc.rpt-30.rpt
    ├── 5_route_drc.rpt-35.rpt
    ├── 5_route_drc.rpt-40.rpt
    ├── 5_route_drc.rpt-45.rpt
    ├── 5_route_drc.rpt-5.rpt
    ├── 5_route_drc.rpt-50.rpt
    ├── 5_route_drc.rpt-55.rpt
    ├── 5_route_drc.rpt-60.rpt
    ├── VDD.rpt
    ├── drt_antennas.log
    ├── grt_antennas.log
    ├── synth_check.txt
    └── synth_stat.txt

2 directories, 25 files
shwetank@shwetank-VirtualBox:~/OpenROAD-flow-scripts/flow$ tree platforms/sky130
sky130hd/  sky130hs/  sky130io/  sky130ram/ 
shwetank@shwetank-VirtualBox:~/OpenROAD-flow-scripts/flow$ tree platforms/sky130hd/
cdl/                config.mk           gds/                make_tracks.tcl     sky130hd.lyp
cells_adders_hd.v   drc/                lef/                pdn.tcl             sky130hd.lyt
cells_clkgate_hd.v  fastroute.tcl       lib/                rcx_patterns.rules  tapcell.tcl
cells_latch_hd.v    fill.json           lvs/                setRC.tcl           
shwetank@shwetank-VirtualBox:~/OpenROAD-flow-scripts/flow$ tree platforms/sky130hd/lib/sky130_
sky130_dummy_io.lib                         sky130_fd_sc_hd__ss_n40C_1v28.lib
sky130_fd_sc_hd__ff_100C_1v65.lib           sky130_fd_sc_hd__ss_n40C_1v35.lib
sky130_fd_sc_hd__ff_100C_1v95.lib           sky130_fd_sc_hd__ss_n40C_1v40.lib
sky130_fd_sc_hd__ff_n40C_1v56.lib           sky130_fd_sc_hd__ss_n40C_1v44.lib
sky130_fd_sc_hd__ff_n40C_1v65.lib           sky130_fd_sc_hd__ss_n40C_1v60_ccsnoise.lib
sky130_fd_sc_hd__ff_n40C_1v76.lib           sky130_fd_sc_hd__ss_n40C_1v60.lib
sky130_fd_sc_hd__ff_n40C_1v95_ccsnoise.lib  sky130_fd_sc_hd__ss_n40C_1v76.lib
sky130_fd_sc_hd__ff_n40C_1v95.lib           sky130_fd_sc_hd__tt_025C_1v80.lib
sky130_fd_sc_hd__ss_100C_1v40.lib           sky130_fd_sc_hd__tt_100C_1v80.lib
sky130_fd_sc_hd__ss_100C_1v60.lib           
shwetank@shwetank-VirtualBox:~/OpenROAD-flow-scripts/flow$ tree platforms/sky130hd/lib/sky130_
sky130_dummy_io.lib                         sky130_fd_sc_hd__ss_n40C_1v28.lib
sky130_fd_sc_hd__ff_100C_1v65.lib           sky130_fd_sc_hd__ss_n40C_1v35.lib
sky130_fd_sc_hd__ff_100C_1v95.lib           sky130_fd_sc_hd__ss_n40C_1v40.lib
sky130_fd_sc_hd__ff_n40C_1v56.lib           sky130_fd_sc_hd__ss_n40C_1v44.lib
sky130_fd_sc_hd__ff_n40C_1v65.lib           sky130_fd_sc_hd__ss_n40C_1v60_ccsnoise.lib
sky130_fd_sc_hd__ff_n40C_1v76.lib           sky130_fd_sc_hd__ss_n40C_1v60.lib
sky130_fd_sc_hd__ff_n40C_1v95_ccsnoise.lib  sky130_fd_sc_hd__ss_n40C_1v76.lib
sky130_fd_sc_hd__ff_n40C_1v95.lib           sky130_fd_sc_hd__tt_025C_1v80.lib
sky130_fd_sc_hd__ss_100C_1v40.lib           sky130_fd_sc_hd__tt_100C_1v80.lib
sky130_fd_sc_hd__ss_100C_1v60.lib           
shwetank@shwetank-VirtualBox:~/OpenROAD-flow-scripts/flow$ tree platforms/sky130hd/lib/
platforms/sky130hd/lib/
├── sky130_dummy_io.lib
├── sky130_fd_sc_hd__ff_100C_1v65.lib
├── sky130_fd_sc_hd__ff_100C_1v95.lib
├── sky130_fd_sc_hd__ff_n40C_1v56.lib
├── sky130_fd_sc_hd__ff_n40C_1v65.lib
├── sky130_fd_sc_hd__ff_n40C_1v76.lib
├── sky130_fd_sc_hd__ff_n40C_1v95.lib
├── sky130_fd_sc_hd__ff_n40C_1v95_ccsnoise.lib
├── sky130_fd_sc_hd__ss_100C_1v40.lib
├── sky130_fd_sc_hd__ss_100C_1v60.lib
├── sky130_fd_sc_hd__ss_n40C_1v28.lib
├── sky130_fd_sc_hd__ss_n40C_1v35.lib
├── sky130_fd_sc_hd__ss_n40C_1v40.lib
├── sky130_fd_sc_hd__ss_n40C_1v44.lib
├── sky130_fd_sc_hd__ss_n40C_1v60.lib
├── sky130_fd_sc_hd__ss_n40C_1v60_ccsnoise.lib
├── sky130_fd_sc_hd__ss_n40C_1v76.lib
├── sky130_fd_sc_hd__tt_025C_1v80.lib
└── sky130_fd_sc_hd__tt_100C_1v80.lib

1 directory, 19 files
shwetank@shwetank-VirtualBox:~/OpenROAD-flow-scripts/flow$ ~/OpenROAD-flow-scripts/tools/OpenROAD/build/bin/openroad -version
v2.0-26087-g3bcda7705d 
shwetank@shwetank-VirtualBox:~/OpenROAD-flow-scripts/flow$ ls -lh results/sky130hd/VSDBabySoC/base/6_final.spef
-rw-rw-r-- 1 shwetank shwetank 23M Nov 24 20:26 results/sky130hd/VSDBabySoC/base/6_final.spef
shwetank@shwetank-VirtualBox:~/OpenROAD-flow-scripts/flow$ head -50 results/sky130hd/VSDBabySoC/base/6_final.spef
*SPEF "ieee 1481-1999"
*DESIGN "vsdbabysoc"
*DATE "20:26:49 Monday November 24, 2025"
*VENDOR "The OpenROAD Project"
*PROGRAM "OpenROAD"
*VERSION "v2.0-26087-g3bcda7705d"
*DESIGN_FLOW "NAME_SCOPE LOCAL" "PIN_CAP NONE"
*DIVIDER /
*DELIMITER :
*BUS_DELIMITER []
*T_UNIT 1 NS
*C_UNIT 1 PF
*R_UNIT 1 OHM
*L_UNIT 1 HENRY

*NAME_MAP
*1 CLK
*2 ENb_CP
*3 ENb_VCO
*4 net10
*5 REF
*6 RV_TO_DAC\[0\]
*7 RV_TO_DAC\[1\]
*8 RV_TO_DAC\[2\]
*9 RV_TO_DAC\[3\]
*10 RV_TO_DAC\[4\]
*11 RV_TO_DAC\[5\]
*12 RV_TO_DAC\[6\]
*13 RV_TO_DAC\[7\]
*14 RV_TO_DAC\[8\]
*15 RV_TO_DAC\[9\]
*16 VCO_IN
*17 VREFH
*18 _00000_
*19 _00001_
*20 _00002_
*21 _00003_
*22 _00004_
*23 _00005_
*24 _00006_
*25 _00007_
*26 _00008_
*27 _00009_
*28 _00010_
*29 _00011_
*30 _00012_
*31 _00013_
*32 _00014_
*33 _00015_
*34 _00016_
shwetank@shwetank-VirtualBox:~/OpenROAD-flow-scripts/flow$ cat results/sky130hd/VSDBabySoC/base/1_synth.sdc | grep -E "create_clock|set_input|set_output"
create_clock [get_pins {pll/CLK}] -name clk -period 11
shwetank@shwetank-VirtualBox:~/OpenROAD-flow-scripts/flow$ nano run_multi_corner_sta.sh
shwetank@shwetank-VirtualBox:~/OpenROAD-flow-scripts/flow$ nano extract_timing_metrics.py
shwetank@shwetank-VirtualBox:~/OpenROAD-flow-scripts/flow$ nano plot_timing_graphs.py
shwetank@shwetank-VirtualBox:~/OpenROAD-flow-scripts/flow$ cd ~/OpenROAD-flow-scripts/flow
shwetank@shwetank-VirtualBox:~/OpenROAD-flow-scripts/flow$ chmod +x run_multi_corner_sta.sh
shwetank@shwetank-VirtualBox:~/OpenROAD-flow-scripts/flow$ chmod +x extract_timing_metrics.py
shwetank@shwetank-VirtualBox:~/OpenROAD-flow-scripts/flow$ chmod +x plot_timing_graphs.py
shwetank@shwetank-VirtualBox:~/OpenROAD-flow-scripts/flow$ sudo pip3 install matplotlib numpy
[sudo] password for shwetank: 
Collecting matplotlib
  Downloading matplotlib-3.10.7-cp310-cp310-manylinux2014_x86_64.manylinux_2_17_x86_64.whl (8.7 MB)
     ━━━━━━━━━━━━━━━━━━━━━━━━━━━━━━━━━━━━━━━━ 8.7/8.7 MB 6.4 MB/s eta 0:00:00
Collecting numpy
  Downloading numpy-2.2.6-cp310-cp310-manylinux_2_17_x86_64.manylinux2014_x86_64.whl (16.8 MB)
     ━━━━━━━━━━━━━━━━━━━━━━━━━━━━━━━━━━━━━━━━ 16.8/16.8 MB 18.6 MB/s eta 0:00:00
Requirement already satisfied: python-dateutil>=2.7 in /usr/lib/python3/dist-packages (from matplotlib) (2.8.1)
Requirement already satisfied: pillow>=8 in /usr/lib/python3/dist-packages (from matplotlib) (9.0.1)
Collecting packaging>=20.0
  Downloading packaging-25.0-py3-none-any.whl (66 kB)
     ━━━━━━━━━━━━━━━━━━━━━━━━━━━━━━━━━━━━━━━━ 66.5/66.5 KB 2.0 MB/s eta 0:00:00
Collecting kiwisolver>=1.3.1
  Downloading kiwisolver-1.4.9-cp310-cp310-manylinux_2_12_x86_64.manylinux2010_x86_64.whl (1.6 MB)
     ━━━━━━━━━━━━━━━━━━━━━━━━━━━━━━━━━━━━━━━━ 1.6/1.6 MB 16.0 MB/s eta 0:00:00
Collecting fonttools>=4.22.0
  Downloading fonttools-4.60.1-cp310-cp310-manylinux2014_x86_64.manylinux_2_17_x86_64.whl (4.8 MB)
     ━━━━━━━━━━━━━━━━━━━━━━━━━━━━━━━━━━━━━━━━ 4.8/4.8 MB 18.7 MB/s eta 0:00:00
Collecting cycler>=0.10
  Downloading cycler-0.12.1-py3-none-any.whl (8.3 kB)
Collecting pyparsing>=3
  Downloading pyparsing-3.2.5-py3-none-any.whl (113 kB)
     ━━━━━━━━━━━━━━━━━━━━━━━━━━━━━━━━━━━━━━━━ 113.9/113.9 KB 1.5 MB/s eta 0:00:00
Collecting contourpy>=1.0.1
  Downloading contourpy-1.3.2-cp310-cp310-manylinux_2_17_x86_64.manylinux2014_x86_64.whl (325 kB)
     ━━━━━━━━━━━━━━━━━━━━━━━━━━━━━━━━━━━━━━━━ 325.0/325.0 KB 7.1 MB/s eta 0:00:00
Installing collected packages: pyparsing, packaging, numpy, kiwisolver, fonttools, cycler, contourpy, matplotlib
  Attempting uninstall: pyparsing
    Found existing installation: pyparsing 2.4.7
    Not uninstalling pyparsing at /usr/lib/python3/dist-packages, outside environment /usr
    Can't uninstall 'pyparsing'. No files were found to uninstall.
Successfully installed contourpy-1.3.2 cycler-0.12.1 fonttools-4.60.1 kiwisolver-1.4.9 matplotlib-3.10.7 numpy-2.2.6 packaging-25.0 pyparsing-3.2.5
WARNING: Running pip as the 'root' user can result in broken permissions and conflicting behaviour with the system package manager. It is recommended to use a virtual environment instead: https://pip.pypa.io/warnings/venv
shwetank@shwetank-VirtualBox:~/OpenROAD-flow-scripts/flow$ ./run_multi_corner_sta.sh
Starting Multi-Corner Multi-Stage STA Analysis
Total corners to analyze: 16

==================================================

.
.
.

openroad> set summary_file [open "/home/shwetank/OpenROAD-flow-scripts/flow/reports/sta_across_pvt/postroute_ss_n40C_1v40_summary.txt" w]
file5
openroad> puts $summary_file "Timing Analysis Summary"
openroad> puts $summary_file "Corner: ss_n40C_1v40"
openroad> puts $summary_file "Stage: postroute"
openroad> puts $summary_file "======================================"
openroad> puts $summary_file "Setup Analysis (Max Delay):"
openroad> puts $summary_file "  Worst Negative Slack (WNS): $wns_max"
openroad> puts $summary_file "  Total Negative Slack (TNS): $tns_max"
openroad> puts $summary_file "Hold Analysis (Min Delay):"
openroad> puts $summary_file "  Worst Hold Slack (WHS): $wns_min"
openroad> puts $summary_file "  Total Hold Slack (THS): $tns_min"
openroad> close $summary_file
openroad> 
openroad> # Print to console
openroad> puts "======================================"
======================================
openroad> puts "Timing Summary for ss_n40C_1v40 - postroute"
Timing Summary for ss_n40C_1v40 - postroute
openroad> puts "======================================"
======================================
openroad> puts "Setup: WNS = $wns_max, TNS = $tns_max"
Setup: WNS = -1.4480515453385578e-8, TNS = -4.178029030299513e-6
openroad> puts "Hold:  WHS = $wns_min, THS = $tns_min"
Hold:  WHS = 1.0158196506182549e-9, THS = 0.0
openroad> puts "======================================"
======================================
openroad> 
openroad> exit
Successfully completed STA for ss_n40C_1v40 at postroute stage


==================================================
Multi-Corner STA Analysis Complete
==================================================
Reports directory: /home/shwetank/OpenROAD-flow-scripts/flow/reports/sta_across_pvt
Logs directory: /home/shwetank/OpenROAD-flow-scripts/flow/logs/sta_corners

Summary files generated for all corners:
64
files
shwetank@shwetank-VirtualBox:~/OpenROAD-flow-scripts/flow$ cat reports/sta_across_pvt/week3_vs_week8_comparison.csv
PVT Corner,WNS (Week 3),WNS (Week 8),WNS Δ,TNS (Week 3),TNS (Week 8),TNS Δ,WHS (Week 3),WHS (Week 8),WHS Δ,THS (Week 3),THS (Week 8),THS Δ
tt_025C_1v80,13.2248,5.614169129586344,-7.610630870413656,0,0.0,N/A,-0.9196,2.9248514721302854,3.8444514721302854,0,0.0,N/A
tt_100C_1v80,13.1105,5.808608261048676,-7.3018917389513245,0,0.0,N/A,-0.9225,2.9846924931575813,3.907192493157581,0,0.0,N/A
ff_100C_1v65,14.1957,6.760198623112501,-7.435501376887499,0,0.0,N/A,-0.9794,2.3589785680400155,3.3383785680400155,0,0.0,N/A
ff_100C_1v95,14.4775,7.76156738879763,-6.715932611202369,0,0.0,N/A,-1.0304,1.86527959744609,2.8956795974460903,0,0.0,N/A
ff_n40C_1v56,13.5215,5.268936842384164,-8.252563157615835,0,0.0,N/A,-0.9372,2.7138924441061363,3.651092444106136,0,0.0,N/A
ff_n40C_1v65,14.1391,6.119451168018486,-8.019648831981513,0,0.0,N/A,-0.9704,2.390526665507764,3.360926665507764,0,0.0,N/A
ff_n40C_1v76,14.4299,6.854450784743449,-7.575449215256551,0,0.0,N/A,-1.0002,2.119233122321873,3.119433122321873,0,0.0,N/A
ff_n40C_1v95,14.4817,7.664580081723216,-6.817119918276784,0,0.0,N/A,-1.0351,1.7900064763765045,2.8251064763765044,0,0.0,N/A
ss_100C_1v40,2.4186,-4.901785644051415,-7.320385644051415,0,-6.341936682474625,N/A,-0.3383,8.588898481320939,8.92719848132094,0,0.0,N/A
ss_100C_1v60,7.4282,3.53189477664273,-3.8963052233572704,0,0.0,N/A,-0.5993,6.090303816819187,6.689603816819187,0,0.0,N/A
ss_n40C_1v28,-25.8257,-3.646461976813953,22.17923802318605,-15887.3154,-1.557138421048876,15885.75826157895,0.6073,1.6140693226418534,1.0067693226418535,0,0.0,N/A
ss_n40C_1v35,-11.2755,-2.10158539459826,9.17391460540174,-4808.0137,-7.570308753201971,4800.4433912467985,0.1261,1.2080831890415311,1.081983189041531,0,0.0,N/A
ss_n40C_1v40,-5.1016,-1.4480515453385578,3.6535484546614425,-1117.0438,-4.178029030299513,1112.8657709697004,-0.1017,1.0158196506182549,1.1175196506182548,0,0.0,N/A
ss_n40C_1v44,-1.5401,-1.0717863929698979,0.46831360703010216,-50.8507,-2.4038695300987456,48.44683046990126,-0.242,8.999265777021037,9.241265777021038,0,0.0,N/A
ss_n40C_1v60,6.4124,-2.2383312980878145,-8.650731298087814,0,-9.886905161238246,N/A,-0.5685,6.08410433144968,6.65260433144968,0,0.0,N/A
ss_n40C_1v76,9.9776,1.6360788279712324,-8.341521172028768,0,0.0,N/A,-0.7442,4.601310443774764,5.3455104437747645,0,0.0,N/A
shwetank@shwetank-VirtualBox:~/OpenROAD-flow-scripts/flow$ ls -1 reports/sta_across_pvt/*_summary.txt | wc -l
64
shwetank@shwetank-VirtualBox:~/OpenROAD-flow-scripts/flow$ ls -1 reports/sta_across_pvt/*.rpt | wc -l  
128
shwetank@shwetank-VirtualBox:~/OpenROAD-flow-scripts/flow$ ls -lh reports/sta_across_pvt/timing_metrics_all.*
-rw-rw-r-- 1 shwetank shwetank 4.6K Nov 25 02:38 reports/sta_across_pvt/timing_metrics_all.csv
-rw-rw-r-- 1 shwetank shwetank 8.5K Nov 25 02:38 reports/sta_across_pvt/timing_metrics_all.json
shwetank@shwetank-VirtualBox:~/OpenROAD-flow-scripts/flow$ ls -lh reports/sta_across_pvt/graphs/*.png
-rw-rw-r-- 1 shwetank shwetank 309K Nov 25 02:38 reports/sta_across_pvt/graphs/setup_slack_heatmap.png
-rw-rw-r-- 1 shwetank shwetank 286K Nov 25 02:38 reports/sta_across_pvt/graphs/ths_comparison.png
-rw-rw-r-- 1 shwetank shwetank 556K Nov 25 02:38 reports/sta_across_pvt/graphs/tns_comparison.png
-rw-rw-r-- 1 shwetank shwetank 211K Nov 25 02:38 reports/sta_across_pvt/graphs/violations_by_corner_type.png
-rw-rw-r-- 1 shwetank shwetank 570K Nov 25 02:38 reports/sta_across_pvt/graphs/whs_comparison.png
-rw-rw-r-- 1 shwetank shwetank 591K Nov 25 02:38 reports/sta_across_pvt/graphs/wns_comparison.png
shwetank@shwetank-VirtualBox:~/OpenROAD-flow-scripts/flow$ ls -lh reports/sta_across_pvt/week3_vs_week8_comparison.csv
-rw-rw-r-- 1 shwetank shwetank 2.3K Nov 25 02:38 reports/sta_across_pvt/week3_vs_week8_comparison.csv
shwetank@shwetank-VirtualBox:~/OpenROAD-flow-scripts/flow$ nano reports/sta_across_pvt/week3_baseline.json
shwetank@shwetank-VirtualBox:~/OpenROAD-flow-scripts/flow$ python3 extract_timing_metrics.py reports/sta_across_pvt
Extracting timing metrics from all corners and stages...
============================================================
Extracted: postsynth    | tt_025C_1v80     | WNS=  7.4272 TNS=    0.0000
Extracted: postsynth    | tt_100C_1v80     | WNS=  7.5114 TNS=    0.0000
Extracted: postsynth    | ff_100C_1v65     | WNS=  8.1562 TNS=    0.0000
Extracted: postsynth    | ff_100C_1v95     | WNS=  8.7921 TNS=    0.0000
Extracted: postsynth    | ff_n40C_1v56     | WNS=  7.3488 TNS=    0.0000
Extracted: postsynth    | ff_n40C_1v65     | WNS=  7.8241 TNS=    0.0000
Extracted: postsynth    | ff_n40C_1v76     | WNS=  8.2479 TNS=    0.0000
Extracted: postsynth    | ff_n40C_1v95     | WNS=  8.7441 TNS=    0.0000
Extracted: postsynth    | ss_100C_1v40     | WNS=  6.2146 TNS=    0.0000
Extracted: postsynth    | ss_100C_1v60     | WNS=  4.0044 TNS=    0.0000
Extracted: postsynth    | ss_n40C_1v28     | WNS= -1.8217 TNS=   -5.5881
Extracted: postsynth    | ss_n40C_1v35     | WNS= -8.9425 TNS=   -2.0930
Extracted: postsynth    | ss_n40C_1v40     | WNS= -4.9181 TNS=   -8.0073
Extracted: postsynth    | ss_n40C_1v44     | WNS= -2.5811 TNS=   -1.8866
Extracted: postsynth    | ss_n40C_1v60     | WNS=  2.6524 TNS=    0.0000
Extracted: postsynth    | ss_n40C_1v76     | WNS=  5.0790 TNS=    0.0000
Extracted: postplace    | tt_025C_1v80     | WNS=  7.2714 TNS=    0.0000
Extracted: postplace    | tt_100C_1v80     | WNS=  7.3793 TNS=    0.0000
Extracted: postplace    | ff_100C_1v65     | WNS=  8.1790 TNS=    0.0000
Extracted: postplace    | ff_100C_1v95     | WNS=  8.8194 TNS=    0.0000
Extracted: postplace    | ff_n40C_1v56     | WNS=  7.3283 TNS=    0.0000
Extracted: postplace    | ff_n40C_1v65     | WNS=  7.8380 TNS=    0.0000
Extracted: postplace    | ff_n40C_1v76     | WNS=  8.2878 TNS=    0.0000
Extracted: postplace    | ff_n40C_1v95     | WNS=  8.7947 TNS=    0.0000
Extracted: postplace    | ss_100C_1v40     | WNS= -1.6435 TNS=   -1.3671
Extracted: postplace    | ss_100C_1v60     | WNS=  3.4928 TNS=    0.0000
Extracted: postplace    | ss_n40C_1v28     | WNS= -2.0487 TNS=   -5.8699
Extracted: postplace    | ss_n40C_1v35     | WNS= -1.0385 TNS=   -1.9368
Extracted: postplace    | ss_n40C_1v40     | WNS= -6.1315 TNS=   -6.8581
Extracted: postplace    | ss_n40C_1v44     | WNS= -3.6259 TNS=   -1.2645
Extracted: postplace    | ss_n40C_1v60     | WNS=  1.9735 TNS=    0.0000
Extracted: postplace    | ss_n40C_1v76     | WNS=  4.6078 TNS=    0.0000
Extracted: postcts      | tt_025C_1v80     | WNS=  7.2418 TNS=    0.0000
Extracted: postcts      | tt_100C_1v80     | WNS=  7.3515 TNS=    0.0000
Extracted: postcts      | ff_100C_1v65     | WNS=  8.1492 TNS=    0.0000
Extracted: postcts      | ff_100C_1v95     | WNS=  8.7934 TNS=    0.0000
Extracted: postcts      | ff_n40C_1v56     | WNS=  7.2956 TNS=    0.0000
Extracted: postcts      | ff_n40C_1v65     | WNS=  7.8040 TNS=    0.0000
Extracted: postcts      | ff_n40C_1v76     | WNS=  8.2556 TNS=    0.0000
Extracted: postcts      | ff_n40C_1v95     | WNS=  8.7662 TNS=    0.0000
Extracted: postcts      | ss_100C_1v40     | WNS= -2.3582 TNS=   -2.0301
Extracted: postcts      | ss_100C_1v60     | WNS=  3.4392 TNS=    0.0000
Extracted: postcts      | ss_n40C_1v28     | WNS= -2.0631 TNS=   -5.9313
Extracted: postcts      | ss_n40C_1v35     | WNS= -1.0515 TNS=   -1.9784
Extracted: postcts      | ss_n40C_1v40     | WNS= -6.2424 TNS=   -7.1981
Extracted: postcts      | ss_n40C_1v44     | WNS= -3.7143 TNS=   -1.4163
Extracted: postcts      | ss_n40C_1v60     | WNS=  1.9097 TNS=    0.0000
Extracted: postcts      | ss_n40C_1v76     | WNS=  4.5674 TNS=    0.0000
Extracted: postroute    | tt_025C_1v80     | WNS=  5.6142 TNS=    0.0000
Extracted: postroute    | tt_100C_1v80     | WNS=  5.8086 TNS=    0.0000
Extracted: postroute    | ff_100C_1v65     | WNS=  6.7602 TNS=    0.0000
Extracted: postroute    | ff_100C_1v95     | WNS=  7.7616 TNS=    0.0000
Extracted: postroute    | ff_n40C_1v56     | WNS=  5.2689 TNS=    0.0000
Extracted: postroute    | ff_n40C_1v65     | WNS=  6.1195 TNS=    0.0000
Extracted: postroute    | ff_n40C_1v76     | WNS=  6.8545 TNS=    0.0000
Extracted: postroute    | ff_n40C_1v95     | WNS=  7.6646 TNS=    0.0000
Extracted: postroute    | ss_100C_1v40     | WNS= -4.9018 TNS=   -6.3419
Extracted: postroute    | ss_100C_1v60     | WNS=  3.5319 TNS=    0.0000
Extracted: postroute    | ss_n40C_1v28     | WNS= -3.6465 TNS=   -1.5571
Extracted: postroute    | ss_n40C_1v35     | WNS= -2.1016 TNS=   -7.5703
Extracted: postroute    | ss_n40C_1v40     | WNS= -1.4481 TNS=   -4.1780
Extracted: postroute    | ss_n40C_1v44     | WNS= -1.0718 TNS=   -2.4039
Extracted: postroute    | ss_n40C_1v60     | WNS= -2.2383 TNS=   -9.8869
Extracted: postroute    | ss_n40C_1v76     | WNS=  1.6361 TNS=    0.0000
============================================================

CSV report generated: reports/sta_across_pvt/timing_metrics_all.csv
JSON report generated: reports/sta_across_pvt/timing_metrics_all.json
Comparison table generated: reports/sta_across_pvt/week3_vs_week8_comparison.csv

============================================================
TIMING ANALYSIS SUMMARY
============================================================

POSTSYNTH:
  Setup Slack Range: -8.9425 to 8.7921 ns
  Hold Slack Range:  1.1249 to 9.9090 ns
  Setup Violations: 4/16 corners
  Hold Violations:  0/16 corners

POSTPLACE:
  Setup Slack Range: -6.1315 to 8.8194 ns
  Hold Slack Range:  1.0878 to 9.5706 ns
  Setup Violations: 5/16 corners
  Hold Violations:  0/16 corners

POSTCTS:
  Setup Slack Range: -6.2424 to 8.7934 ns
  Hold Slack Range:  1.0794 to 9.5048 ns
  Setup Violations: 5/16 corners
  Hold Violations:  0/16 corners

POSTROUTE:
  Setup Slack Range: -4.9018 to 7.7616 ns
  Hold Slack Range:  1.0158 to 8.9993 ns
  Setup Violations: 6/16 corners
  Hold Violations:  0/16 corners

============================================================
Metric extraction complete!
============================================================
shwetank@shwetank-VirtualBox:~/OpenROAD-flow-scripts/flow$ python3 plot_timing_graphs.py reports/sta_across_pvt/timing_metrics_all.json reports/sta_across_pvt/graphs

Generating timing visualization graphs...
============================================================
Generated: reports/sta_across_pvt/graphs/wns_comparison.png
Generated: reports/sta_across_pvt/graphs/tns_comparison.png
Generated: reports/sta_across_pvt/graphs/whs_comparison.png
Generated: reports/sta_across_pvt/graphs/ths_comparison.png
Generated: reports/sta_across_pvt/graphs/setup_slack_heatmap.png
Generated: reports/sta_across_pvt/graphs/violations_by_corner_type.png
============================================================
All graphs generated successfully in: reports/sta_across_pvt/graphs

Visualization complete!
shwetank@shwetank-VirtualBox:~/OpenROAD-flow-scripts/flow$ 



